{
  "schema_version": "7.0",
  "run_id": "c4c1ec43-295a-4482-b1c1-3cb7db1f5a90",
  "agent_name": "example",
  "status": "succeeded",
  "confidence": 0.5,
  "reasoning_summary": "example",
  "warnings": [
    "example"
  ],
  "requires_human_review": true,
  "completed_at": "2026-07-31T12:00:00Z",
  "title": "example",
  "scenario": "example",
  "steps": [
    {
      "step_no": 1,
      "instruction": "example",
      "expected_result": "example",
      "evidence_ids": [
        "7cb26f84-ec30-4a3e-b3c3-fa4e26aa4ab0"
      ]
    }
  ],
  "deliverables": [
    "example"
  ],
  "acceptance_criteria": [
    "example"
  ],
  "safety_notes": [
    "example"
  ],
  "evidence": [
    {
      "evidence_id": "7c682593-705c-425f-a0b2-10f1a57424e9",
      "knowledge_node_id": "example"
    }
  ]
}
